{
  "status": "ready",
  "feature_name": "tob-oa-office-demo",
  "feature_type": "general",
  "one_liner": "人事：员工档案、组织架构",
  "project_mode": "hybrid",
  "project_mode_source": "heuristic",
  "project_mode_confidence": 0.6,
  "project_mode_evidence": [
    "当前仅有 SDD 工作区上下文，缺少真实业务工程事实"
  ],
  "project_mode_confirmed_by": "zhangsan",
  "capability_tags": [
    "api",
    "async",
    "db-change",
    "security-sensitive"
  ],
  "risk_tier": "high",
  "requirements": [
    {
      "req_id": "REQ-001",
      "priority": "P0",
      "title": "人事",
      "description": "人事：员工档案、组织架构"
    },
    {
      "req_id": "REQ-002",
      "priority": "P1",
      "title": "审批",
      "description": "审批：请假、加班、报销、流程自定义"
    },
    {
      "req_id": "REQ-003",
      "priority": "P1",
      "title": "公告通知、消息推送",
      "description": "公告通知、消息推送"
    },
    {
      "req_id": "REQ-004",
      "priority": "P1",
      "title": "日程考勤、打卡签到",
      "description": "日程考勤、打卡签到"
    },
    {
      "req_id": "REQ-005",
      "priority": "P1",
      "title": "文件网盘、在线预览",
      "description": "文件网盘、在线预览"
    },
    {
      "req_id": "REQ-006",
      "priority": "P1",
      "title": "面向 ToB 企业客户",
      "description": "面向 ToB 企业客户，需支持多角色协同使用。"
    },
    {
      "req_id": "REQ-007",
      "priority": "P1",
      "title": "审批流程需要具备一定可配置性",
      "description": "审批流程需要具备一定可配置性。"
    },
    {
      "req_id": "REQ-008",
      "priority": "P1",
      "title": "文件能力至少支持上传、下载与常见办公文件在线预览",
      "description": "文件能力至少支持上传、下载与常见办公文件在线预览。"
    }
  ],
  "ambiguities": [
    "project_mode 当前为 hybrid，置信度不足 0.8，建议人工确认。"
  ],
  "entities": [
    {
      "name": "ToB",
      "kind": "domain-entity",
      "evidence": "PRD 出现标识符 ToB"
    },
    {
      "name": "审批",
      "kind": "domain-entity",
      "evidence": "PRD 中出现业务对象 审批"
    },
    {
      "name": "通知",
      "kind": "domain-entity",
      "evidence": "PRD 中出现业务对象 通知"
    },
    {
      "name": "消息",
      "kind": "domain-entity",
      "evidence": "PRD 中出现业务对象 消息"
    },
    {
      "name": "Employee",
      "kind": "domain-entity",
      "evidence": "由接口路径 /api/v1/hr/employees 推导"
    },
    {
      "name": "Org",
      "kind": "domain-entity",
      "evidence": "由接口路径 /api/v1/hr/org-tree 推导"
    },
    {
      "name": "Approval",
      "kind": "domain-entity",
      "evidence": "由接口路径 /api/v1/approvals 推导"
    },
    {
      "name": "Leave",
      "kind": "domain-entity",
      "evidence": "由接口路径 /api/v1/approvals/leave 推导"
    },
    {
      "name": "Overtime",
      "kind": "domain-entity",
      "evidence": "由接口路径 /api/v1/approvals/overtime 推导"
    },
    {
      "name": "Reimburse",
      "kind": "domain-entity",
      "evidence": "由接口路径 /api/v1/approvals/reimburse 推导"
    },
    {
      "name": "Notice",
      "kind": "domain-entity",
      "evidence": "由接口路径 /api/v1/notices 推导"
    },
    {
      "name": "Message",
      "kind": "domain-entity",
      "evidence": "由接口路径 /api/v1/messages/push 推导"
    }
  ],
  "apis": [
    {
      "method": "GET",
      "path": "/api/v1/hr/employees",
      "summary": "GET employees",
      "evidence": "GET /api/v1/hr/employees"
    },
    {
      "method": "POST",
      "path": "/api/v1/hr/employees",
      "summary": "POST employees",
      "evidence": "POST /api/v1/hr/employees"
    },
    {
      "method": "GET",
      "path": "/api/v1/hr/org-tree",
      "summary": "GET org tree",
      "evidence": "GET /api/v1/hr/org-tree"
    },
    {
      "method": "GET",
      "path": "/api/v1/approvals",
      "summary": "GET approvals",
      "evidence": "GET /api/v1/approvals"
    },
    {
      "method": "POST",
      "path": "/api/v1/approvals/leave",
      "summary": "POST leave",
      "evidence": "POST /api/v1/approvals/leave"
    },
    {
      "method": "POST",
      "path": "/api/v1/approvals/overtime",
      "summary": "POST overtime",
      "evidence": "POST /api/v1/approvals/overtime"
    },
    {
      "method": "POST",
      "path": "/api/v1/approvals/reimburse",
      "summary": "POST reimburse",
      "evidence": "POST /api/v1/approvals/reimburse"
    },
    {
      "method": "POST",
      "path": "/api/v1/approvals/process-definitions",
      "summary": "POST process definitions",
      "evidence": "POST /api/v1/approvals/process-definitions"
    },
    {
      "method": "GET",
      "path": "/api/v1/notices",
      "summary": "GET notices",
      "evidence": "GET /api/v1/notices"
    },
    {
      "method": "POST",
      "path": "/api/v1/notices",
      "summary": "POST notices",
      "evidence": "POST /api/v1/notices"
    },
    {
      "method": "POST",
      "path": "/api/v1/messages/push",
      "summary": "POST push",
      "evidence": "POST /api/v1/messages/push"
    },
    {
      "method": "GET",
      "path": "/api/v1/attendance/records",
      "summary": "GET records",
      "evidence": "GET /api/v1/attendance/records"
    }
  ],
  "business_rules": [
    "需求：ToB 企业 OA 办公系统",
    "面向 ToB 企业客户，需支持多角色协同使用",
    "审批流程需要具备一定可配置性"
  ],
  "dependencies": [],
  "clarify": null,
  "metadata": {
    "source_file": "docs\\tob-oa-office-prd.md",
    "generated_at": "2026-05-07T17:21:59+08:00",
    "generator": "requirement-analyzer.extract",
    "ai_used": false,
    "ai_model": null,
    "notes": [
      "应用了 CLI 覆盖参数"
    ]
  }
}